"product_code","description","most_ordered_count"
"M4-2477997x","Traditional Lace Voile 55 x 90' - White""","146"
"M4-1688574Q","Cesar Country Kitchen Dog Food 8 x 150g","132"
"N5-2042057y","LEGO Technic Ducati Panigale V4 R Motorbike","132"
"t6-7799310b","Terry's Segsations Pouch 360g","131"
"G0-0687586c","Cable Knit Sherpa Throw","130"
"v7-2622427T","Fox's Chocolatey Biscuit Selection Tin","129"
"v7-6917295v","Tiffany's World Fabulous Food Truck","129"
"f4-3814039X","Dried Flower Arrangement","128"
"r7-8691931c","Doggie Delights Dog Treats 125g - Mini Chicken Whirls","128"
"I1-2299515d","Christmas Tealight Holder - Reindeer","128"
